{
  "schemaId": "cd-collab.log_workbench_search_request.v1",
  "query": "upstream timeout",
  "mode": "case_insensitive",
  "filters": {
    "includeTerms": ["edge"],
    "excludeTerms": ["healthz"],
    "severity": "error",
    "component": "edge",
    "file": "gateway/edge.log",
    "rotationFamily": "gateway/edge.log",
    "timeFrom": "2024-03-10T07:00:00.000Z",
    "timeTo": "2024-03-10T09:00:00.000Z",
    "evidenceIds": ["22222222-2222-4222-8222-222222222222"]
  },
  "contextBefore": 2,
  "contextAfter": 2,
  "cursor": 0,
  "limit": 50,
  "expectedNormalizationRevision": 3
}
